{
  "$schema": "https://json-schema.org/draft/2020-12/schema",
  "type": "object",
  "properties": {
    "colors": {
      "type": "object",
      "propertyNames": {
        "type": "string",
        "pattern": "^[A-Za-z0-9][A-Za-z0-9-]*$"
      },
      "additionalProperties": {
        "type": "string"
      }
    },
    "shadows": {
      "type": "object",
      "propertyNames": {
        "type": "string",
        "pattern": "^[A-Za-z0-9][A-Za-z0-9-]*$"
      },
      "additionalProperties": {
        "type": "string"
      }
    },
    "backDropBlurs": {
      "type": "object",
      "propertyNames": {
        "type": "string",
        "pattern": "^[A-Za-z0-9][A-Za-z0-9-]*$"
      },
      "additionalProperties": {
        "type": "string"
      }
    },
    "borderRadius": {
      "type": "object",
      "propertyNames": {
        "type": "string",
        "pattern": "^[A-Za-z0-9][A-Za-z0-9-]*$"
      },
      "additionalProperties": {
        "type": "string"
      }
    },
    "fontFamily": {
      "type": "object",
      "propertyNames": {
        "type": "string",
        "pattern": "^[A-Za-z0-9][A-Za-z0-9-]*$"
      },
      "additionalProperties": {
        "type": "string"
      }
    },
    "borderWidth": {
      "type": "object",
      "propertyNames": {
        "type": "string",
        "pattern": "^[A-Za-z0-9][A-Za-z0-9-]*$"
      },
      "additionalProperties": {
        "type": "string"
      }
    },
    "$schema": {
      "type": "string"
    },
    "typography": {
      "type": "object",
      "propertyNames": {
        "type": "string",
        "pattern": "^[A-Za-z0-9][A-Za-z0-9-]*$"
      },
      "additionalProperties": {
        "type": "object",
        "properties": {
          "fontSize": {
            "type": "string"
          },
          "lineHeight": {
            "type": "string"
          },
          "fontWeight": {
            "type": "number",
            "minimum": 1,
            "maximum": 1000
          },
          "letterSpacing": {
            "type": "string"
          },
          "fontFamily": {
            "type": "string"
          },
          "fontStyle": {
            "type": "string"
          }
        },
        "required": ["fontSize", "lineHeight", "fontWeight"],
        "additionalProperties": false
      }
    },
    "themeAxes": {
      "type": "object",
      "propertyNames": {
        "type": "string",
        "pattern": "^[A-Za-z0-9][A-Za-z0-9-]*$"
      },
      "additionalProperties": {
        "type": "object",
        "propertyNames": {
          "type": "string",
          "pattern": "^[A-Za-z0-9][A-Za-z0-9-]*$"
        },
        "additionalProperties": {
          "type": "object",
          "properties": {
            "colors": {
              "type": "object",
              "propertyNames": {
                "type": "string",
                "pattern": "^[A-Za-z0-9][A-Za-z0-9-]*$"
              },
              "additionalProperties": {
                "type": "string"
              }
            },
            "shadows": {
              "type": "object",
              "propertyNames": {
                "type": "string",
                "pattern": "^[A-Za-z0-9][A-Za-z0-9-]*$"
              },
              "additionalProperties": {
                "type": "string"
              }
            },
            "backDropBlurs": {
              "type": "object",
              "propertyNames": {
                "type": "string",
                "pattern": "^[A-Za-z0-9][A-Za-z0-9-]*$"
              },
              "additionalProperties": {
                "type": "string"
              }
            },
            "borderRadius": {
              "type": "object",
              "propertyNames": {
                "type": "string",
                "pattern": "^[A-Za-z0-9][A-Za-z0-9-]*$"
              },
              "additionalProperties": {
                "type": "string"
              }
            },
            "fontFamily": {
              "type": "object",
              "propertyNames": {
                "type": "string",
                "pattern": "^[A-Za-z0-9][A-Za-z0-9-]*$"
              },
              "additionalProperties": {
                "type": "string"
              }
            },
            "borderWidth": {
              "type": "object",
              "propertyNames": {
                "type": "string",
                "pattern": "^[A-Za-z0-9][A-Za-z0-9-]*$"
              },
              "additionalProperties": {
                "type": "string"
              }
            }
          },
          "additionalProperties": false
        }
      }
    }
  },
  "required": ["colors"],
  "additionalProperties": false
}
